{
  "allowed_scope": [
    "IDENTIFIER_QUANTITY_PRICE_FEE_RECONCILIATION",
    "BALANCE_POSITION_TIMESTAMP_RECONCILIATION",
    "MATCH_TOLERATED_MINOR_CRITICAL_CLASSIFICATION",
    "EXACT_DELTA_COMPUTATION",
    "VERSIONED_TOLERANCE_EVALUATION",
    "SOURCE_OF_TRUTH_RESOLUTION",
    "RECONCILIATION_REPORTING",
    "RECONCILIATION_VETO",
    "ORPHAN_DUPLICATE_DETECTION",
    "IDEMPOTENT_RESTART_RECONCILIATION",
    "FAIL_CLOSED_PAUSE_BLOCK_KILL_SWITCH"
  ],
  "base_commit": "ff9bff8e670d2d6dd86df713c4baf5d0228e53c8",
  "current_version": "0.34.0",
  "forbidden_scope": [
    "EXTERNAL_NETWORK_ACCESS",
    "LIVE_EXCHANGE_DATA",
    "REAL_CREDENTIALS",
    "DESTRUCTIVE_RAW_DATA_CORRECTION",
    "MARKET_DATA_QUALITY_ENGINE_REIMPLEMENTATION",
    "FRESHNESS_GAP_OUTAGE_V3_CLOSURE",
    "CONTINUOUS_MARKET_STATE_PUBLICATION",
    "FORECAST_GENERATION",
    "SIGNAL_GENERATION",
    "RISK_APPROVAL",
    "ORDER_ROUTING",
    "TRADING",
    "EXECUTION"
  ],
  "gate_status": "GO_LOT35_IMPLEMENTATION_ENTRY",
  "human_decision": "APPROVED_START_LOT35",
  "implementation_started": false,
  "next_lot": 36,
  "next_lot_status": "PLANNED_LOCKED",
  "output_checksum": "e3ca9847c39a9ab8a043639cda556308506e9d5a497eb7821d3b962278c507ab",
  "owner": "MarketDataGovernanceDomain",
  "prerequisites": {
    "anti_flake_repetitions": 3,
    "branch_coverage_percent": 97.3,
    "latest_implemented_lot": 34,
    "line_coverage_percent": 98.8,
    "lot34_anomaly_count": 0,
    "lot34_audit_checksum": "cd4410a2ea9ef6cdc061caf5115d908d03575e219eb9f4da402bff1712f6c7ce",
    "lot34_implementation_merged_commit": "27880f7e14f3d1c97cce9a73f9fe4b5498947068",
    "lot34_post_merge_audit_commit": "ff9bff8e670d2d6dd86df713c4baf5d0228e53c8",
    "lot34_quality_score_bps": 10000,
    "lot34_record_count": 3,
    "lot34_state_checksum": "bc66816383ddf141016ad66796cc5dd4ad3442cd3594d96ad1f7db13d7c6bc01",
    "lot34_status": "IMPLEMENTED_VALIDATED_DATA_QUALITY_ONLY",
    "lot34_veto_action": "ALLOW_ANALYSIS",
    "mutation_score_percent": 84.0
  },
  "quality_gates": {
    "anti_flake_repetitions": 3,
    "branch_coverage_min_percent": 90,
    "line_coverage_min_percent": 95,
    "mutation_score_min_percent": 80
  },
  "required_outputs": [
    "CandleTradeBookReconciliationStateV1",
    "CandleTradeBookReconciliationAuditV1",
    "ReconciliationReportV1",
    "ReconciliationVetoV1"
  ],
  "runtime_mode": "DATA_GOVERNANCE_ONLY",
  "safety": {
    "analysis_only": true,
    "approved_size": 0,
    "execution_allowed": false,
    "external_connectivity_allowed": false,
    "market_event_publication_allowed": false,
    "network_ingestion_allowed": false,
    "order_routing_allowed": false,
    "raw_data_mutation_allowed": false,
    "real_credentials_allowed": false,
    "risk_approval_allowed": false,
    "signal_generation_allowed": false,
    "trade_allowed": false,
    "used_for_decision": false
  },
  "schema_version": "lot35-v3-entry-gate-v1",
  "target_lot": 35
}
